{
  "$schema": "http://json-schema.org/draft-07/schema#",
  "version": "1.0.0",
  "type": "object",
  "properties": {
    "schemaVersion": {
      "type": "string"
    },
    "name": {
      "type": "string"
    },
    "description": {
      "type": "string"
    },
    "contentEncoding": {
      "type": "string"
    },
    "source": {
      "type": "string"
    },
    "metadata": {
      "type": "object",
      "additionalProperties": true
    },
    "data": {
      "type": "array",
      "items": {
        "type": "object",
        "properties": {
          "content": {
            "type": "string"
          },
          "metadata": {
            "type": "object",
            "additionalProperties": true,
            "properties": {
              "source": {
                "type": "string",
                "description": "Source identifier for the data item"
              }
            },
            "required": ["source"]
          }
        },
        "required": ["content", "metadata"]
      }
    }
  },
  "required": ["schemaVersion", "name", "data"]
}
