{
  "schemaVersion": "1.0.0",
  "name": "plain_text_records",
  "description": "A sample plain_text_records for demonstration purposes",
  "contentEncoding": "utf-8",
  "source": "file: ./sample_text.txt",
  "metadata": {
    "author": "John Doe",
    "created_at": "2023-10-01T12:00:00Z",
    "customField": "customValue"
  },
  "data": [
    {
      "content": "This is the first paragraph of text content.",
      "metadata": {
        "source": "table_xxxx_column_yyyy",
        "description": "This is a sample text content from a table column."
      }
    },
    {
      "content": "This is the second paragraph with more text.",
      "metadata": {
        "source": "table_xxxx_column_zzzz",
        "description": "This is a sample text content from another table column."
      }
    }
  ]
}
